{"iss":"https://verifier.zone-b.example","outcome_id":"00000000-0000-4000-8000-000000000001","client_id":"fx-client","challenge":"fx-challenge-0123456789ab","audience":"https://zone-b.example/resource","claims":{"role":"participant","entitlement":"read"},"credential_refs":["urn:uuid:00000000-0000-4000-8000-0000000000aa"],"verified_at":"2026-09-09T12:00:00Z","expires_at":"2026-09-09T12:02:00Z","status":"verified"}
